{
  "protocol_version": "1.0",
  "message_id": "msg_01J0M00000000000000000000B",
  "type": "node.log_event",
  "sent_at": "2026-07-29T08:00:10Z",
  "payload": {
    "node_id": "node_01J0M000000000000000000000",
    "level": "info",
    "message": "job lifecycle event",
    "fields": {
      "job_id": "job_01J0M000000000000000000000"
    },
    "logged_at": "2026-07-29T08:00:10Z"
  }
}

