{
  "protocol_version": "1.0",
  "message_id": "msg_01J0M000000000000000000004",
  "type": "model.ready",
  "sent_at": "2026-07-29T08:00:00Z",
  "payload": {
    "node_id": "node_01J0M000000000000000000000",
    "model_id": "thirdshift-small-chat-v1",
    "model_hash": "sha256:6b2f000000000000000000000000000000000000000000000000000000000000",
    "runtime_hash": "sha256:91aa000000000000000000000000000000000000000000000000000000000000",
    "loaded_at": "2026-07-29T08:00:00Z"
  }
}

