{
  "protocol_version": "1.0",
  "message_id": "msg_01J0M00000000000000000000D",
  "type": "node.config_updated",
  "sent_at": "2026-07-29T08:00:00Z",
  "payload": {
    "config_version": "cfg_01J0M000000000000000000000",
    "heartbeat_interval_seconds": 15,
    "max_job_seconds": 120,
    "updated_at": "2026-07-29T08:00:00Z"
  }
}

