{
  "protocol_version": "1.0",
  "message_id": "msg_01J0M00000000000000000000H",
  "type": "job.cancel",
  "sent_at": "2026-07-29T08:00:20Z",
  "payload": {
    "job_id": "job_01J0M000000000000000000000",
    "attempt_id": "att_01J0M000000000000000000000",
    "reason": "deadline_exceeded",
    "cancelled_at": "2026-07-29T08:00:20Z"
  }
}

